{
  "$schema": "../../../../schema/book.schema.json",
  "slug": "high-performance-mysql",
  "title": "High Performance MySQL",
  "subtitle": "Proven Strategies for Operating at Scale",
  "authors": [
    "Silvia Botros",
    "Jeremy Tinley"
  ],
  "year": 2021,
  "edition": null,
  "publisher": "O'Reilly Media",
  "pages": 389,
  "kind": "book",
  "category": "data",
  "subcategory": "mysql",
  "tags": [
    "sql"
  ],
  "files": [
    {
      "lang": "en",
      "format": "pdf",
      "path": "en.pdf",
      "bytes": 7584908,
      "md5": "8c16222f3f1d79340e41e8505f2b530d"
    }
  ]
}
