{
  "$schema": "../../../../schema/book.schema.json",
  "slug": "designing-data-intensive-applications",
  "title": "Designing Data-Intensive Applications",
  "subtitle": "The Big Ideas Behind Reliable, Scalable, and Maintainable Systems",
  "authors": [
    "Martin Kleppmann"
  ],
  "year": 2017,
  "edition": null,
  "publisher": "O'Reilly Media",
  "pages": 613,
  "kind": "book",
  "category": "data",
  "subcategory": "fundamentals",
  "tags": [
    "distributed-systems",
    "nosql",
    "scalability",
    "sql",
    "streaming"
  ],
  "files": [
    {
      "lang": "en",
      "format": "pdf",
      "path": "en.pdf",
      "bytes": 24975901,
      "md5": "bf7c3fecfe5dcffceb170b2aa6d34c31"
    }
  ]
}
