{
  "$schema": "../../../../schema/book.schema.json",
  "slug": "beginning-database-design-solutions-2e",
  "title": "Beginning Database Design Solutions",
  "subtitle": "Understanding and Implementing Database Design Concepts for the Cloud and Beyond",
  "authors": [
    "Rod Stephens"
  ],
  "year": 2023,
  "edition": 2,
  "publisher": "Wiley",
  "pages": 739,
  "kind": "book",
  "category": "data",
  "subcategory": "modeling",
  "tags": [
    "cloud-native",
    "sql"
  ],
  "files": [
    {
      "lang": "en",
      "format": "pdf",
      "path": "en.pdf",
      "bytes": 39972208,
      "md5": "ea719d394a188ac4b4082378ae798a2f"
    }
  ]
}
