{
  "$schema": "../../../../schema/book.schema.json",
  "slug": "pro-git",
  "title": "Pro Git",
  "subtitle": null,
  "authors": [
    "Scott Chacon_ Ben Straub"
  ],
  "year": null,
  "edition": null,
  "publisher": null,
  "pages": 506,
  "kind": "book",
  "category": "programming",
  "subcategory": "tooling",
  "tags": [
    "git"
  ],
  "files": [
    {
      "lang": "en",
      "format": "pdf",
      "path": "en.pdf",
      "bytes": 18915172,
      "md5": "eca660b839d125a083407397018c5857"
    }
  ]
}
